surface,path,check,observed,blocker,decision_effect
MoFit repository,https://github.com/JoonsungJeon/MoFit,"gh repo view; README; recursive tree path filter","Official ICLR 2026 MoFit implementation; default branch main; pushed 2026-05-27; README describes caption-free MIA, COCO/Flickr/Pokemon/LAION-mi support, and evaluation scripts","Public code and examples exist, but target checkpoints are referenced as local paths rather than immutable public checkpoint hashes","High-priority support/candidate surface, not admitted evidence"
COCO MoFit score-like table,Results/COCO/COCO_emb_500images_train_t_[140].txt,"GitHub contents metadata; raw text replay","size=13690; sha=6f6dde8940ba162055bb6118053eb4c575c190d6; 501 lines including header; 500 numeric rows; header records local sd-COCO checkpoint path","Rows are numeric scores without explicit row IDs or schema; header contains private/local checkpoint path","Reusable score-like table, but row binding and target identity incomplete"
COCO MoFit score-like table,Results/COCO/COCO_emb_500images_test_t_[140].txt,"GitHub contents metadata; raw text replay","size=13797; sha=75918cee48e68758a97bc7744cbb065a77505312; 501 lines including header; 500 numeric rows; header records local sd-COCO checkpoint path","Rows are numeric scores without explicit row IDs or schema; header contains private/local checkpoint path","Reusable score-like table, but row binding and target identity incomplete"
COCO BLIP baseline table,Results/COCO/COCO_blip_500images_train_t_[140].txt,"GitHub contents metadata; raw text replay","size=29027; sha=580dca642bafe6bc53735c98cc7a252199348a04; 501 lines including header; 500 numeric rows","Used by official evaluation as VLM baseline/fusion input; no explicit row IDs in result rows","Supports metric replay only"
COCO BLIP baseline table,Results/COCO/COCO_blip_500images_test_t_[140].txt,"GitHub contents metadata; raw text replay","size=29531; sha=ccfb53fd7f198d8196988a618a7c08bfafd3df5a; 501 lines including header; 500 numeric rows","Used by official evaluation as VLM baseline/fusion input; no explicit row IDs in result rows","Supports metric replay only"
COCO member captions,data/Captions/COCO/blip2_members_2500_captions.jsonl,"GitHub contents metadata; raw first rows","size=179789; sha=c04b46f1d95daf1547e71e894d511d8d39708e6d; rows contain filename and caption fields","Caption JSONL has filename IDs, but result txt rows do not explicitly carry those IDs; first-500 row binding is inferred from script/order, not manifest-certified","Potential row-binding lead, not admission"
COCO nonmember captions,data/Captions/COCO/blip2_non_members_2458_captions.jsonl,"GitHub contents metadata; raw first rows","size=177451; sha=5740b8ed2691e83fbf59c5f3622a9d77e71652ef; rows contain filename and caption fields","Caption JSONL has filename IDs, but result txt rows do not explicitly carry those IDs; first-500 row binding is inferred from script/order, not manifest-certified","Potential row-binding lead, not admission"
CPU metric replay,public COCO txt files plus Eval/mia_th_COCO.py logic,"CPU-only replay using public raw txt files; no clone; no model execution","Official logic takes e[-2] from MoFit tables, -e[-2] from BLIP tables, RobustScaler-normalizes train/test+baseline, sweeps alpha in 0..1 step 0.05; strict finite-tail replay uses max TPR under the FPR budget; best alpha=0.55, ASR=0.883, AUC=0.941948, TPR@1%FPR=0.488, TPR@0.1%FPR=0.324","Strong metric replay exists, but target checkpoint identity, explicit row binding, machine-readable metric JSON, and no-training verifier are incomplete","High-priority follow-up candidate; no C14/N50/admitted/compute upgrade"
