review_order,scout_queue_id,title,artifact_surface_hint,followup_bucket,source_kinds,gate_review_focus,risk_or_duplicate,signal_items_sample
1,E2SCT-011,VAE2Diffusion,score_or_metric_surface_hint,priority_gate_review,arxiv;github,Check README asset links and score/ROC artifacts,Same author family and asset links may be empty,"summary:The recovery of training data from generative models (""model inversion"") has been extensively studied for diffus"
2,E2SCT-020,LSA-Probe music diffusion,score_or_metric_surface_hint,priority_gate_review,arxiv;github,Verify repo status and absence or presence of score arrays,Mock demo data risk,"summary:Membership inference attacks (MIAs) test whether a specific audio clip was used to train a model, making them a "
3,E2SCT-022,Tabular Privacy Leakage TDM,split_checkpoint_surface_hint,priority_gate_review,arxiv;github,Check paper-specific Berka/Diabetes packets,Overlaps MIDST or tabular lane,"summary:Tabular data plays an important role in many fields and industries, including those with elevated privacy consid"
4,E2SCT-023,FERMI,split_checkpoint_surface_hint,priority_gate_review,arxiv,Refresh source and search for official code/scores,Paper-source-only risk,summary:Diffusion models are the leading approach for tabular data synthesis and are increasingly used to share sensitiv
5,E2SCT-002,DMin data attribution,score_or_metric_surface_hint,review_semantics_before_freeze_candidate,github;huggingface_dataset,Refresh metadata and separate attribution gates from membership gates,Data attribution semantics may not match MIA,.gitattributes | README.md | data/test-00000-of-00005.parquet | data/test-00001-of-00005.parquet | data/test-00002-of-00005.parquet | data/test-00003-of-00005.parquet | data/test-00004-of-00005.parquet | data/train-00000-of-00017.parquet | data/train-00001-of-00017.parquet | data/train-00002-of-00017.parquet | data/train-00003-of-00017.parquet | data/train-00004-of-00017.parquet | data/train-00005-of-00017.parquet | data/train-00006-of-00017.parquet | data/train-00007-of-00017.parquet | data/train-00008-of-00017.parquet | data/train-00009-of-00017.parquet | data/train-00010-of-00017.parquet | data/train-00011-of-00017.parquet | data/train-00012-of-00017.parquet | data/train-00013-of-00017.parquet | data/train-00014-of-00017.parquet | data/train-00015-of-00017.parquet | data/train-00016-of-00017.parquet
6,E2SCT-004,GenAI Confessions black-box,split_only_surface_hint,artifact_followup,github;zenodo_record,Check whether generated outputs or DreamSim scores are public,Target checkpoint and response packet may be missing,hanyfarid/MembershipInference-datarelease.zip size=133599324 checksum=md5:6ec572d777fd04ef6cdedc712d2b
7,E2SCT-019,VidLeaks T2V,code_only_surface_hint,artifact_followup,zenodo_record,Check live repo/release and score CSV/video manifests,T2V cross-modal and live repo risk,wangli-codesT2V_MIA-v1.0.1.zip size=1521848 checksum=md5:001e45be0e4229aead4f14011d12
