item,status,evidence,boundary
repository_commit,partial,"`git ls-remote https://github.com/aindo-com/remia.git refs/heads/main` returned `84da2feee749b56639f8c8d9a6bbfffdbc0e87b3` on 2026-06-09.","public code/archive identity is fixed for this check"
archive_manifest,partial,"`experiments.tar.xz` was checked in temp only; size `445,364` bytes; SHA-256 `26F903EEE3355912BEA3AE8D80E3C066F19556D46A06F374789EF992B2ED1C3E`; the archive contains `2,879` JSON files and no CSV files.","public run archive exists, but contents are run-level JSON summaries"
privacy_metrics,partial,"Archive groups include `remia_1.0`, `remia_0.5`, `domias`, `dcr_mia`, `dcr_comparison`, `shadow_modeling_achilles_median`, and `shadow_modeling_achilles_heels`; DDPM generator paths contribute `60` JSON files.","tabular synthetic-data privacy benchmark surface, not image-diffusion denominator evidence"
json_schema,fail,"Recursive schema check found `408` list values, longest list length `1`, and `0` lists with length >=20 or >=100; AUC, accuracy, `n`, and successes are scalar fields.","row_bound_score_label_packet_missing"
csv_export_path,fail,"`scripts/experiments_to_csv.py` builds rows from `d[""input""]`, `d[""output""][""summary""]`, time, and timestamp; it writes aggregate privacy and quality CSVs if run locally.","flattened run-level summary, not per-record labels/scores"
remia_code_path,partial,"`src/remia.py` computes AUC internally from validation hooks and returns scalar fields such as `auc`, `accuracy`, `n`, `step`, and `auc_diff`.","method code has internal row arrays, but the public archive does not expose them"
consumer_boundary,fail,"The checked surface is tabular synthetic-data privacy evaluation, not image-diffusion public score/response evidence.","not an image-diffusion denominator row"
admission_decision,fail,"support-only tabular synthetic-data aggregate-result archive; aggregate_run_json_only; no_compute_release","do not admit, do not add to C14/N50, do not release compute"
